,body,score
446,overturned due to high sticking,2
447,"He hasn’t started since I bought his jersey, so I’m a little worried now lol",2
448,🤨📸,2
449,"Oof, good luck with the switch",2
450,"I did that switch around this time three years ago. I'm sorry to report that your fear that it's going to suck is 100% valid. It gets much easier, though. When I started with this company, I was drinking three Monsters a day. Now, I barely need one Monster (on days I'm so tired/hungover).",2
451,Off Frosts skate/body then over the net and off Saros's back,2
452,Skate. Goalies back and in,2
453,"Off the glass, off frost, rolled down the goalie’s back and fell in. Weirdest carom ever.",2
454,"Fuck, guess he needs some company in that - I'm on it",2
455,You’re welcome,2
456,Now it is,1
457,"Advice from boxing ref Mils Lane that is good across every situation in everybody's life: ""Protect yourself at all times.""  Playing Hockey?  Protect yourself at all times.  Driving on the freeway?  Protect yourself at all times.  Shopping for Christmas?  Yep, Protect yourself at all times.",2
458,"playoff game I believe, I remember watching the caps score like what, four? They got a few.",2
459,"I think you’re right.  Frost *just* got out of the doghouse, and Torts has him on a short leash.  Expect it to be yanked soon",2
460,Ya the pp is depressing,3
461,u/emogothpunk,3
462,What are you talking about? We bought ours at the start of this season. AT THE GARBAGE STORE.,3
463,We have to commit a penalty in order to get one.,3
464,"I find when I have this a shower really helps, or I put on headphones and dance around like a maniac to music. Movement and water really help.

Hope you're doing all right, Bulb!",3
465,He was stalling for a line change,2
466,"Miracle on 34th st b&w is on Disney+
I’ve seen it color and no color and the no color is better",3
467,sin city 2: a dame to kill for (2014),2
468,Strangers on a train or something Hitchcock,2
469,The Killing is one of my favorite oldies,2
470,Angels with filthy souls,2
471,Arsenic and Old Lace,2
472,The original Bonnie and Clyde is fantastic,1
473,It's a Wonderful Life,1
474,"I might wanna drink some acid after this game if we don't win or at least get a point

edit: yeah get me some ocean spray or concentrated sulphuric acid, doesn't matter which",2
475,I’m shirking from home tomorrow.,3
476,"Nice shot!

Nice shot!

Nice shot!",3
477,You got me there,3
478,"Thought it was glitching or some shit. Then I saw a comment from a Kings fan about Pierre Luc-Dubois and I was like “damn, that guy’s pretty lost.”",2
479,I wouldn’t get my hopes up,2
480,"Nope, they doubled down and called Staal for getting run into.",2
481,"Ryan Ellis. All this ""who?"" talk is just a gigantic cover up attempt propagated by Big Crime.",3
482,Their child named Ryan.,2
483,No totally I’m just fucking around. I like that he looks at both sides but in this instance I think it was obviously a major lmao,4
484,"Makes sense, especially since this particular instance involves a check that could easily cause a concussion. Might be more about sending a message than whether the check was malicious enough for a game misconduct.",2
485,finataics,2
486,as is tradition,2
487,I restarted ESPN plus like 3 times haha. Not shocked after the echo issue last game.,2
488,EGP 😍,2
489,No this is an advertisement,3
490,https://media1.giphy.com/media/v1.Y2lkPTc5MGI3NjExNnphNHZmZHBoMjA0cjUybXN0enJleHBsejQycmFwaGFma2J0YXp2MCZlcD12MV9pbnRlcm5hbF9naWZfYnlfaWQmY3Q9Zw/3oEdv6sy3ulljPMGdy/giphy.gif,3
491,im using this line,2
492,Bonjour! I hope you’re slaying,2
493,Literally just commented to brag 💅🏼,2
494,Same as it ever was,3
495,Oh good call on the pigeon.,2
496,"bUt I dOnT wANnA wEar tHe nEW oNe. 

Makes me want to play in traffic.",3
497,Haha I forget what the one from last year was but ik they have 2 in rotation with that family rn,2
498,Thanks - yeah it was dead silent in here for a moment like wtf...then the siren.,2
499,"just looked it up. december 5th, 2009. i think you’re right though, they scored four on that.",3
500,Not the first or last time I’ve heard that after climbing out of the shower,2
501,"Thanks, Smokey! Are you a pacifist by chance?",1
502,That commercial reminded me of making jungle juice back in the year…,1
503,"Wait, you're a fuckin' shrink?",2
504,Chat disabled,3
505,😭😭 this is too funny,2
506,"ohhhhh ok. my bad, i'm bad at picking up on shit like that, especially when it isn't in person lol",3
507,"I think so. NHLPA and the league have been way more strict and seem to not show any leniency with it. I love a good physical game, but I think it’s the right move",2
508,the real product was all the friends we made along the way,2
509,Isn’t that the same thing,2
510,"I WILL DUTIFULLY SHELL OUT MONEY THE ALMIGHTY PIZZA

&#x200B;

&#x200B;

\*gasp\* in all seriousness, now I know what my lunch will be tomorrow.",2
511,Doing well today?,2
512,SHRED SOME POW,2
513,It was like dude pulled up with his new car for Christmas and a bow decoration flew off the trees and onto the roof of it so when the dad came out of the house he assumed the car was for him,2
514,2 MINUTES FOR SELF-DEPRECATION,2
515,Nope.  Why do you ask?,2
516,Haha you’re all good! I know it can be hard for some people to read tone over text. That’s why I tried to throw in a little “lmfao”😭,3
517,"I agree. Hockey is a physical sport and that shouldn't change, but checks like that are dangerous. when the player can't prepare in any way for the hit and most of the impact is directed to their head, not only do you open the door to concussions but also neck injuries. both of those have the potential to be career ending.",2
518,It always is here at r/flyers 🥹,2
519,I am! I hope you are too!!,2
520,"Floor it. 

I hate that I have the lines memorized.",2
521,It was a Big Lebowski joke 🤭,1
522,Nice marmot.,2
523,You can’t. You can’t own one of those. Not in city limits.,2
0,Fuck the Caps. May their unsustainable place in the standings begin its precipitous fall tonight.,15
1,"Remember when we knocked the Caps out in back to back playoffs and went onto win the Stanley Cup 2 years in a row?

Those were good times. 

Obligatory “Fuck Tom Wilson”.",17
2,"Heartfelt ""fuck you"" to whoever decided streaming exclusives were acceptable.",14
3,big big 4 point game to win against a division rival. pens win will go a long way to reducing the gap with league leaders with a win tonight ... fuck Tom Wilson,12
4,"This is another ""streaming exclusive"" game isn't it...",13
5,"New year, new opportunity to update the sidebar with the current schedule and standings!",11
6,"We’ll obviously wait and see what Sullivan says, but Rust is taking line rushes with Malkin and Smith at the morning skate and is eligible to come off LTIR today, so chances seem pretty good that he’s in tonight.",10
7,"I posted this in an r/hockey thread, but I'll repost here for good memories.

I'll offer the [Backstrom own-goal against the Pens with :29 left in the third while tied, 2-2.](https://www.youtube.com/watch?v=8T9NZn1lskE)

Watch OV right after the goal, lol.

I had just moved to DC and a coworker invited me to his house to watch the game, told me to wear my Pens gear, I got there in my signed Lemieux jersey, stuffed animal penguin hat, Pens pajama pants and Pens slippers.  It was just his family there at first, then some die hard Caps fans showed up, then some more, there were about 20 Caps fans and just one lone Penguins fan wearing all that and cramped in his basement gameroom...and then this happened.  It was glorious!",10
8,"To the team I love to hate the most:

Fuck the Caps.🥰

And I'll never forgive Tom Wilson. Fuck you right in the ear.",8
9,LGP and FTW!,7
10,LGP.,6
11,Good bunch of games recently. Keep the streak going baby!,5
12,"Tom Wilson thinks Jar-Jar is the best character in Star Wars. 

&#x200B;

Also, thank you to the maker of the thread. Hope Iceborg's rehab is going well",6
13,"I saw on PensInsideScoop early that Rust will be on Malkin's line and the 3rd will be O'Connor, Eller, Puustinen, which I'm very excited to see.  4th listed as Harkins, Cookie, and the curious case of Jeff Carter.",6
14,"Sorry if this has been answered previously, but can I watch if I’m in Pittsburgh & have basic Hulu?",4
15,Tom Wilson dines at Super Weenie Hut Jr's.,4
16,"Saw in the pregame interviews that Sid has a gnarly black eye, missed the last game while traveling, anyone know how that happened?",4
17,Rust is in tonight. Should help out depth a bit,4
18,Tom Wilson doesn’t let his cat lick its butt…Tom licks it himself.,4
19,Tom Wilson showers with socks on. !wilson,3
20,Normally streaming exclusives don’t touch me because I’m an out of market pen’s fan. That market? Washington DC’s. Dang it!,3
21,Sid's due for a big game.,3
22,Tom Wilson wears socks at the beach.,3
23,Tom Wilson eats pop rocks at movie theatres,3
24,"Wilson’s out in warm ups without a helmet.

I don’t want anyone to get hurt, but if he’d get bonked with a puck and like…started speaking Italian or some shit, and no one could understand him…I wouldn’t be mad.

I’m saying legit cartoon shit is what i want.",3
25,"Not been around here long enough, why do we hate Tom Wilson?

edit: thanks guys. Fuck Tom Wilson.",6
26,Ughhh ESPN stream again. These commercials make me want to kick the stool,2
27,Rust?,1
28,"View in your timezone:  
[Tuesday 01/02/2024 - 7:30PM ET][0]  

[0]: https://timee.io/20240103T0030?tl=GDT%3A%20washington%20capitals%20at%20Pittsburgh%20Penguins%20-%20Tuesday%2001%2F02%2F2024%20-%207%3A30PM%20ET",1
29,Tom Wilson's underpants are spotless  because even skid marks don't like him.,1
30,"What moves do yinz think we need to make at the deadline to give us a chance at making a deep run? I know it's still 2 months away, just curious what everyone thinks",1
31,"Currently experiencing the ESPN ""live sports"" loop for the first time. It makes me want to punch a hole in a concrete wall. I don't know how people can do this regularly without going batshit insane.",1
32,Tom Wilson's favourite fancy restaurant is a 7/11 in Missouri.,1
33,Tom Wilson creates multiple accounts that are banned for karma manipulation relating to Tom Wilson jokes,1
34,Every time the Pens made it to the finals it was going through the Caps.,7
35,"Buddy, I remember when they won 9 out of 10 series against them, and the only one the Caps won was in 7 games.",7
36,remember when caps pens basically was the Stanley Cup final?,2
37,But how else would we learn about Espn's 30 for 30 catalogue...80x per commercial break?,5
38,"I'll add to that ""fuck you!""",3
39,Nothing is exclusive on the high seas. 🏴‍☠️🏴‍☠️,22
40,"A good friend of mine once told me she liked Jar Jar, thought he was cute and really funny.  I'm not much of a Star Wars fan, but I can't even look at her the same knowing her feelings for that muppet.",1
41,"i’m from UK so can’t answer your question other than suggest that if any TV channel fails you can always resort to onhockey.tv, arm yourself with add block though.",2
42,If you’re in Pittsburgh most likely no. It’ll be blacked out regardless of app usage. You’ll need to sport surge or cable,1
43,Follow through shot or pass by Barzal. Accidental,3
44,stick to face,2
45,That is an UNDERSTATEMENT,1
46,FUCK TOM WILSON!,3
47,Tom Wilson interrupts  the flow of traffic when he see someone about to cross the street and insists on waving them to cross the street in front of his vehicle thinking he is a awesome dude but really he is just wasting everyone's time.,3
48,"Known for dirty hits

[Exhibit A, Reese broke his jaw IIRC](https://youtu.be/DesV4FgSbsY?si=Wdc2Jmo3LMPzJgci)

[Exhibit B, this was a preseason game](https://youtu.be/V64KXEpeRZY?si=_NJ8jjmRkb3G_GZF)

[Exhibit C, tries to drive Panarin’s head to the ice](https://youtu.be/1B2Ok4zQ0ho?si=RGAnaIwNHe1mqUc9)

Other users could probably explain a lot better than I did, but there’s the basics",16
49,Just a complete piece of shit. He takes joy in head hunting and charging into blindside hits. Smirks when guys are injured.,16
50,"He broke my boy's face. 😡 I know he wasn't gonna be a superstar or anything, but he's never quite been the same since.",8
51,Just watch the game. You’ll see.,5
52,"Ya come on espn wtf happened to ""live sports""",1
53,argh,2
54,"I don't even check xfinity anymore, just push off the dock and set my sails every game.",1
55,"it's a hulu/espn streaming exclusive.  shouldn't be any regional blackouts.  

i'm not sure if basic hulu is enough, but i don't think it is.",1
56,"He's actually laughing after the hit on ZAR... holy fucking shit, fuck Tom Wilson",2
57,"i still can't believe he was ever allowed back after that bullshit with the rangers.

i also can't believe no one has ever been able to put his face through the ice.  i know he's chickenshit, but you'd have to figure eventually he'd get cornered by someone capable of wiping his face off his face.",1
0,"My conspiracy theory is everyone was either creating individual threads for all the different awesomeness from this game, or we were all too drunk to even attempt it from the ""take a shot everytime Letang is a boss"" game.",7
0,"Stop by Larimer Square. It’s where they hang the Avs banners, but it’s usually full of Colorado flags. It’s pretty small but I like Tamayo and Bao Brewhouse. Ocean Prime is spendy, but I’ve heard good things from everybody I sent there (never used my gift cards). Ball is walkable from Larimer.

Walking along Cherry Creek is also fun if you’re a visitor.

The Cruise Room is pretty cool and would be on the way from Union to Ball. It is Art Deco with only red lighting, so I get a bit of a Shining vibe there.

If you want to see where the Cup got dented, then go to Dierk’s Bentley’s Whiskey Row. 🤣

Union Station itself is worth entering if you’re coming off the rail. Maybe for half an hour. It was part of the revitalization project “led” be Dana Crawford. 

https://architectureandplanning.ucdenver.edu/dana-crawford-exhibition#:~:text=Dana%20Hudkins%20Crawford%20was%20born,him%20and%20so%20much%20more!

I slink around Broadway where I used to work, but it is a bit of an extra walk. 16th Street Mall is being updated and won’t be complete until 2025; when I was there in September the center was torn up and partitioned off.",7
1,Cooper lounge in union station is a great setting for a fancy holiday cocktail. We also love Death and Co. (a little farther from walking distance). There’s also a ton of little places in lohi that are cool/kind of close.,3
2,Where are you staying?,3
3,German Christmas market is fun and nearby.,4
4,"Along with other things mentioned, the Denver Christkindlmarket near the capital is awesome to go to. A quick uber or scooter over to Rino for food, bevs and looking at artwork is cool too.",2
5,"Check out the Denver city pass. It gives you like 5-7 events to choose from and discounts for bundling. I have used it a couple of times, and I'm a native! Lol",3
6,If you want to see the mountains take the flatiron flyer bus to Boulder and then either walk or get a Lyft to Chataqua Park. Lots of gorgeous walks and hikes.,2
7,Zoo lights or the botanical gardens are awesome if you can get tickets.,1
8,"Check out RiNo (River North) and LoHi (Lower Highlands) for drinks and food! Both have lots of options and are very walkable. Riverfront area is a nice open green space near by as well.

If you are open to going a bit further out, the Tennyson/41st area is a gem IMHO.

The LoDo (Lower Downtown) and Cap Hill areas are more traditional party/night out areas with a younger crowd, can get a bit sketchy though.

The Christmas market, Botanic Gardens ""Blossoms of Light"", and Daniels & Fisher tower are all festive rn and fun to check out.

Lots of good museums for varying subjects in town. Nature & Science, Art, Aerospace, and Transportation are highlights.

Feel free to DM me if you want any specific restaurant recs!",1
9,"Night of game have a burger at Chop House and uber/walk/barhop to stadium.  You avoid the crowds of Brooklyns (which really stinks frankly), get to see Coors Field and hang at the spot Sackic, Roy and Foresberg hung their hat back in the day.  (Burger because it is a high end steakhouse (casual though)).",1
10,"You can get to some pretty sweet places by rail.  I assume you'll be taking the train from DIA so you've seen quite a bit but I'd recommend taking the Gold line to Arvada and get off at the Arvada Station.  The downtown there is mostly blocked off for walking and is at the rail stop.  Tons to explore there, get a good dinner or lunch and maybe some ice cream then head back to Union Station for a night cap at the terminal bar or go upstairs to the bar others have recommended.  

Just off 10th and Osage station is the oldest restaurant in Denver serving game like Elk and Rocky Mountain Oysters.  

If you didn't come in on the DIA train take the A line to 61st and Pena and either hop the free shuttle to the Gaylord which has like 5 restaurants.  Or walk/bike/scoot/uber a couple blocks to the Moonlight Diner which is a great diner with a full bar.

There's so many things to do here you really just have to make your own fun.  The RINO options suggested are great too or if the weather is good go all the way west on the G line to the end of the line then Uber to Red Rocks because even a day trip there is an adventure.  

My last suggestion is to just hang in Denver.  I love Citizen Rail for a fantastic steak or Jax for some Oysters.  Domo is right off the rail line as well and I heard they reopened.  The Capital building is accessible via free public transit from Union Station and the Capitol is very pretty and light up this time of year.  Also the Capital tour is free and super worth the time imo.  

Have fun, enjoy the game!  Go ASS and Hail Satan",1
11,Larimer square is being worked on and is closed if I'm not mistaken.,2
12,"Walking distance to Ball Arena, maybe a block or two.",2
13,"It is an open, walking only street, but it is missing a lot of its former glory with work and a lot of missing tenants.",2
14,"Go to Meow Wolf for sure. The aquarium is fun. Tivoli brewing. If the weather is nice (it is until friday) and you have time, check out the Botanical gardens and the zoo. Those aren't walking distance, but it's a short Uber. Have breakfast at Sam's #3 at least once.",7
0,Remember when the Avs had a lead going into the 3rd against the defending Stanley Cup champs Tampa Bay lightning and played like the most perfect period of shutdown hockey in history? That’s what I’m gonna choose to think about right now.,42
1,I should have gone to bed when the Avs did,31
2,Can’t wait for the next Toews quote,30
3,"The team fell asleep at 4-1 and refused to wake up until the Yotes won.

We don't deserve the point. That was fucking horrific. Credit to the Yotes they were absolutely dominant the whole 3rd.

Wood with 2 breakaways missed and then he allowed for another breakaway the other direction in OT. Fuck me.",29
4,The dreaded 4 goal lead,25
5,"that might have been the worst 3rd period i’ve ever seen out of the boys. 

We must have given up 8-10 prime scoring opportunities to just make 1 extra pass that did nothing at best and turned the puck over at worst. Also… Manson in overtime is an insanely questionable decision which ultimately led to the gwg. 

Besides all that though, can we please get rid of ryan johansen? he’s a fucking pylon out there and is literally a $4M waste of space.",21
6,"He’s not the sole solution, but I miss Landy :(",21
7,That was fucking pathetic,17
8,"Hang your heads boys, that was fucking embarrassing, up 4 fucking zero and you lose that game.",17
9,Bednar needs to learn what a timeout is. You have no excuse not to call one after that 3rd goal.,39
10,Ngl I hope bednar has em do suicides back and forth like in miracle. That was a weak minded loss. Have a 3rd period like that is disgusting. Manson bro what the fuck man.,15
11,"If you guys all agree, I would prefer to never think or speak of this game ever again",13
12,"One glaring stat - Nuke, Rants, MacKinnon all had around 24-25 minutes of ice time.  That's 6 minutes more than the highest forward on the Coyotes and 15 minutes more than the Avs lowest TOI forward (Kiviranta).

As much as these guys are horses it's just not sustainable long term.  Hopefully when Lehky is back the second line can stabilize a little and you can move pieces a bit but man there were times you could tell Mack couldn't even move in OT.",14
13,Don't worry guys. This is wake up call number 10 this season.,32
14,"The end of that OT was painful. That’s a lot of bad turnovers from guys who we’ve come to expect a lot better from. Not a good look, and doesn’t bode well going forward since they should have had their wake up call about 5 other times this season",12
15,"It is truly inexplicable how this team can be so good for any 2 given periods of a game and then look like they’ve never seen a puck for the remaining period. 

Awful loss. Worst of the year by far.",23
16,Unbelievably low IQ play by Manson at the end there,25
17,Druin (820k salary) out performs RyJo (4 MIL salary) every night.. HMMMMMM,25
18,"5 unanswered, eh? Super fun. The tale of two teams continues.",9
19,"Our D needs to cover the net so much better. They allowed so many shots that just couldn't reasonably be bailed out by Georgie alone. I won't pretend that Georgie's a god, but this is absolutely not entirely on his shoulders.",10
20,We do an absolutely remarkable job of shooting ourselves in the damn foot. How do we get that disheveled after one goal in? It's like an entire defensive breakdown and shattered confidence in net.,12
21,What the actual fuck was that garbage?,10
22,"Dude. Wtf. Checked the score before dinner, we good... again on the way home... 😭",10
23,"I think this is the Avs this season. Good wins and ugly losses. Every time they win it's like “ok we're figuring it out” and then they do shit like last night. This far into the season it's pretty set in stone that this is who we are, will just be a matter of which team shows up come playoffs.",10
24,I’m a big Georgiev fan but he’s been woefully inadequate more often than not this year. And Bednar once again refused to call Timeout when his team was getting bodied. Stupid stubborn Coach.,28
25,"Makar with a blown puck handle behind the net, again. I swear I’ve seen this before. What the shit.",10
26,Fucking embarrassing. Just letting this mediocre team skate circles around our zone like it's nothing.,7
27,"They need to address the defense BADLY. I mean, there are way too many lapses and open chances. 

Sure, Georgie needs to play better too, but at this point it’s not all on him.",17
28,Wtf,7
29,I’m not even going to look at the /r/hockey PGT. I’ll probably have to jump off a bridge.,9
30,Just. What the ever loving fuck?,7
31,This team is mentally weak.,15
32,Josh Manson is a turnover merchant,13
33,I liked the part where the Avs had a 4-0 lead and decided to piss it away against the Yotes,7
34,Terrible outcome of not closing again :(,8
35,What the fuck what the fuck what the fuck,9
36,Absolutely brutal. Not sure why this team seems to just go into the tank after taking a lead. Maybe we should just let the opponent score first every night.,6
37,That was my first in person Avs game and it was a total punch in the nuts,7
38,East coast here -- went to bed at 4-1. What the hell,6
39,"I'm sorry but the yotes don't even fucking deserve that win that's the most fucking annoying part of that game to me

that dumb fuck kissing his stick during their celly like he fucking did something holy shit",10
40,this team is extremely good at blowing large leads. one of the best. excellent. you can't take that away from them,12
41,"Georgiev was not great tonight and hasn’t been great all season. That being said, look at the guys who are supposedly the elite tenders in the league. From most peoples’ consensus top 3, Sorokin, Vasilevskiy, and Shesterkin are 12th, 21st, and 22nd in the league in SV% right now. Bob is 18th. Gibson is 25th. The current top goalies statistically speaking are mostly no names and castoffs. Hellebuyck is really the only supposedly elite goalie in the top 10 and he is 8th. I guess maybe you could argue Demko is close to an elite name, he is 9th.  Adin Hill, who most people probably hadn’t even heard of before last year is 1st. 30 year old Charlie Lindgren who had started 29 games in 6 seasons before last season is 2nd. Swayman can’t really say anything bad about him is 3rd. 36 year old Cam Fucking Talbot is 4th! 37 year old Jonathan Quick is 5th. Goalies are so hard to predict, and getting harder by the minute. Not sure who I would even want the Avs to go after at this point.",10
42,I can forgive a lot but getting beat far side on a wraparound is not acceptable.,13
43,Wtf did I see?,5
44,That shit is so pathetic man. We always do that shit against the yotes in mullet,6
45,![gif](giphy|rqg6cxIInEWg8),8
46,That overtime was a fucking no joke. Over passing bs and no assertiveness. I hate ot,6
47,"Fuck me, I think this was the biggest swing in emotions during a game that I've felt all season. And that's saying something!",4
48,"Never in my god damn life have I seen a play like that one in OT from Josh Manson 

He needs to be benched for that, unacceptable. Guy breaks a stick, you have a chance for a break, and he skated like he was 90 years old and turned it over and blew the game 

Each nachos you fat fuck",20
