,body,score
0,"A competent goalie and a Svech blasting away all over the ice, and I'm a lot damn more optimistic than I was 10 days ago.",32
1,"Holy shit, we’ve hit them with sweet Caroline AND the wave and there’s still ten minutes left to play",27
2,Besides an unlucky bounce Kochetkov had a great period. Nice to see Svech score as well.,21
3,"Even though the score is tied, I honestly felt like we outplayed Vegas that period. If we keep bringing the same energy we’ll get more pucks in the net",21
4,Canes hockey at its best tonight,19
5,Never change this drury svech turbo line they are cooking,26
6,This is the hurricanes team we’ve been waiting for this season!,25
7,"My analysis after 2: The Canes have 3 more goals than Vegas, so if we hold them to 2 goals or less in the 3rd, we will win.",20
8,"Ok, giving Raanta a positive shout out is pretty wholesome.",26
9,It cannot be understated how fucking clutch Kooch getting hot for us is right now.  Holy shit.  We were probably toast,19
10,It's fucking LOUD in pnc for a Tuesday night,19
11,"The crowd is bumpin’ tonight, absolutely love to see it",20
12,You idiots did the wave look at what you’ve done,20
13,Svech scoring a goal and crushing that dude is the reason Svech might be my first NHL jersey.,16
14,WHO IS THIS TEAM?!?! THIS PRESSURE WE’RE APPLYING I LOVE IT,17
15,LOOK AT THIS FUCKING PASSING????,17
16,"You know what would make this night even better?  A lacrosse goal.  Make it happen, Svech.",18
17,Lmaooooo we are too far ahead if we are talking about dog shit live on air,17
18,I love it when Kooch is on. He’s such a fun goalie to watch,15
19,"37 can't do it all, but he changes *everything*. Just killed a man with a trident on the boards.",16
20,THE CANES ARE BACK,17
21,Jesperi ‘y’know’ kotkaniemi intermission interview!! we are winning girls!!,17
22,Hands down best 20 min of hockey this team has played all year. Not even close.,17
23,Omg kooch’s little wiggle after the save,17
24,"Guys, I think Svech is happy to be back.",15
25,Necas immediately went down the tunnel holding his hand :/,16
26,Where the FFFFF has this team been all year?!?! IV THIS STRAIGHT INTO MY JUGULAR,14
27,Outshooting AND outscoring? Smothering D and O? Good goaltending? Power play goals? Am I dreaming?,16
28,Canes hockey is significantly more fun when we crash the net and play the system to its fullest,17
29,"There’s a noticeable silence from a few…certain sub users in this chat. And my question is- are they even fans? Or are they hear to troll, stir the pot, make a meal out of negativity?

I don’t have the answer.  But I’m here cheering for the Canes regardless of the score.

Go Canes!",15
30,Turbo slump breaker and I will cum,15
31,Koochie having a wonderful game. Also a little more shots on his average too so it's looking good for his SV,14
32,I just turned on the game and WHAT IS GOING ON,15
33,Kooch do not be hurt. Holy hell no.,15
34,https://i.redd.it/botpx7xyqc7c1.gif,14
35,Chatty simply cannot be stopped. That dude plays with his whole heart every single day. Pay the man!,13
36,I counted 7 “you know”s by KK,15
37,https://i.redd.it/efiy4yk8yc7c1.gif,13
38,I think we should have started Kochetkov earlier in the season. Was hoping this was gona be his year during the offseason and now he’s finally getting the chance.,16
39,KOOCH IS FUCKING INSANE TONIGHT HOLY SHIT,14
40,that makes me 6-2 my stomach,15
41,koochie is still first star in my eyes,14
42,"I go into this game fully expecting to lose, so anything better than that is a win imo",13
43,did Tripper just call Rod baby???,13
44,"Just walked in the door, got the game on just in time to see Svech score. 

It was me guys, and it's staying on.",13
45,A power play goal?  In this economy?,13
46,Svech just murdered a man,12
47,PK had a hell of a 1st ngl,13
48,"Not too bad of a period, but still needed some big saves by Kochetkov. It certainly good to have a goalie that's playing well in the net.",14
49,Oh fuck. Kooch looks not good,12
50,Kooch is really stepping up as the lead goalie,13
51,CANES HOCKEY IS BACK BABY,15
52,FUCK VEGAS,13
53,"This is hurricanes hockey. 1,2,3, 4, we want 5!",14
54,OOOOOH I WANNA DANCE WITH SOMEBODY,12
55,They play so much better when they're confident in their goalie. It really shows.,12
56,"KK dropping the word ""chaos"" twice.  He got the memo, lol",12
57,This game has gone VASTLY different than I expected,11
58,https://i.redd.it/itszr5ww0d7c1.gif,12
59,"That's okay, you play like you did tonight we can overlook one leaky one against the best team in the league.  Still over .900.",12
60,This is what happens when you do Caroline and the wave,13
61,Tonight seemed like retribution for Svech's ACL.,13
62,"I am entirely too new to being in love with this sport to be feeling this hype

edit: If I comment anything ignorant PLEASE correct me, I'm still learning",13
63,It's great that we have this good and loud of a crowd even after an awful stretch of play. As a fan since the Bad Times it brings a tear to my eyes how much loyalty this team has won.,12
64,Thats wtf im talm bout Kooch you hot Russian bastard,12
65,"Andrei ""the Trans-Siberian railway"" Svechnikov.",12
66,I love watching Svech score a goal and kill a man in his first night back,12
67,Pesce has to be the slowest guy on the team,12
68,I’ve about had it with Pesce. Dude has been horrific,12
69,"""I believe it's in Brett Pesce's pants"" is not on the bingo card",13
70,If Kooch is hurt we are so cooked holy shit,12
71,Koochie can take a pounding and just bounce right back.,12
72,Whatever they gave Svech during his recovery they need to put the whole team on for a couple days. He’s playing like a mad man tonight,12
73,Has Andersen been watching from the box or has been at home playing baldurs gate?,12
74,That might’ve been our best period of the season. Do it again in the third.,12
75,"PP is 2/2, PK is 3/3, Pyotr has stopped 23/24, we’ve had the better 5v5 chances despite having less shots. Love it",11
76,CREATE CHAOS THATS RIGHT KK,13
77,I boinked between the period cause I was fired up. This night just keeps getting better.,13
78,"I met Brady Skjei at a restaurant once - we’d accidentally been given his table. Apparently he was fond of the restaurant and had a specific table he liked, and the management had messed up and gotten their days wrong, (it was Tuesday and they thought he was coming on Thursday or something like that).

Anyway, the manager, completely embarrassed (this is a pretty nice restaurant) comes by and says “I’m so sorry, but we’d like to move you to another table if you could be troubled, and we’ll gladly compensate you for the cost of the meal and any other meal you’d like while you’re in town.” My sister and cousin were both like “Yeah that’s cool.” and I kind of played the asshole a bit.

“I’m sorry, I just don’t understand. We’ve been here for 15 minutes - we’ve just ordered. Can’t we finish our meal here?”

Then out of nowhere Brady hows up next to the manager and leads us in a riveting prayer circle.

And I (being a big Skjeisy fan) said “Oh wow, uh… I had no idea. Please feel free to give them the table.”

Brady was grateful, shook my hand and said thanks, then gave me a card with his number on it and told me to give him a call later. After working up the nerve, I gave him a call that night, and to make a long story short, we had a glorious 11 month love affair, man on man, that I shall never forget. Our bodies intertwined as one, and from the beauty of Morocco, to the French Riviera, to the snorkeling in the Galopagos, Brady Skjei and I made glorious gay love to each other on six of the seven continents.",12
79,I want Kooch to score on MT Knett,13
80,"I forgot what PK stands for


is it pyotor kochetkov or penalty kill 


Whatever it is I think I love it",11
81,Ugh. That was ugly. Good thing the W is already pretty much locked down.,10
82,Kooch is pissed he let that one in after a fantastic fucking showing. Love the attitude kid,13
83,Really hope those last couple goals don’t hit Kooch mentally.,14
84,KOOOOOOOOOOOOOCH,12
85,MISTA SVECHNIKOV,11
86,Don't gang bang the koochie,11
87,"Pesce got absolutely smoked there, I don’t understand what has happened to him.",10
88,"A solid period honestly, up the intensity a little bit and make PK work less in the 2nd",12
89,37’s looking like a man possessed.,10
90,"I ONLY cook with oil, gravy, and gas!!",11
91,I hope necas is okay :'(,12
92,Koooooooooch,11
93,Please don’t hurt my Koochie,11
94,tuning in from cancun! let’s go turbooooooo,11
95,"KK

https://i.redd.it/jwp2ueatqc7c1.gif",12
96,"The goal was great but holy hell, Chatty gets all the love for the hard work!",11
97,"Where was this team?!?!!?

I'm so fucking happy",12
98,"https://i.redd.it/c9so2g19sc7c1.gif

what a game",10
99,"If that's not embellishment, may as well take it out of the book. Happened right in front of me and dude went down like a wounded dove at first touch.",12
100,LOOK AT ME I AM BECOME BITCH HYPER OF RINKS,9
101,Play every period like that one and the cup is coming back to Raleigh,11
102,KK with the 7 “you knows”,11
103,y’know count: six! chaos count: 3(?),11
104,I just want to point out that the Knights are sitting comfortably at the top of the Western conference right now and this is how we are playing against them. We can fucking ball,13
105,"Whatever you live idiots do, don’t you dare do the goddamn wave.",11
106,Canes will build confidence over then next few games and become absolutely dominant. Kooch will completely lock in and it will be “Freddie who?”  Svech will score 25 more. IMO.,12
107," typically, a team should pull their goalie with around 3 minutes left. Considering that we are up by five, we should multiply that three by five, which means they should pull their goalie with 15 minutes left. 

In conclusion, pull your goalie you cowards",9
108,The koochie shuffle there at the end 🥴,10
109,"Whatever they drank, smoked, or boofed before the game, keep doing it for the rest of the season please.",12
110,Call me stingy but I think we need at least one more,11
111,I want to know what goes through non canes fans minds listening to these Tripp Tales,11
112,Is it selfish to want one more goal?,11
113,Can’t score 2 goals against the craps but we score 6 on a team that has allowed more than 4 just twice all season. 3-3 on the PP. Their lone goal just a good hustle play in front of the net. What is this team and why haven’t they been playing the last couple games,10
114,Fuck I wanted an Orlov goal,9
115,"Good. Keeps him humble. 

Pyortr is the way.",11
116,That one wasn't on Kooch,9
117,This is what happens when you do the wave,12
118,You know what this bunting kid seems pretty good,11
119,Rod is just as salty about the faceoff boots as I am. It's been atrocious recently.,11
120,I'M NOT FROM THIS SUB BUT I AM ROOTING FOR YALL! FUCK THE GOLDEN SHITES!,11
121,WELCOME BACK MISTA SVECHNIKOVVV,11
122,That was a sick shot. Wish they showed the replay because I'm curious how Kooch blocked that,10
123,Well that was fun for ten seconds,10
124,Holy shit just insane pass by Noessen,10
125,that svech hit tho 👀,9
126,Bodied by Svech. Avaliable at all fragrance retailers this holiday season,10
127,Daaang those were some close fucking pinball bounces,11
128,Staal’s face was literally 😮 LMAOOOO,10
129,The blood is in the fucking water and the boys are hungry.,10
130,Please tell me Kooch is fine,10
131,THIS looks like a cup winning team. Where the FUCK has this been????,11
132,The reason Cockaniemi is able to score so many goals is that his cock has gained so much mass it creates its own gravitational pull. Just get the puck anywhere near his lower front and the puck gets locked in to the cockfield.,10
133,"BIG COCK MOTHER FUCKIN COCKANIEMI BABY. LOOK UP PENETRATION IN THE DICTIONARY AND YOULL FIND HIS FACE. ALL HE KNOWS HOW TO DO IS SCORE. THIS MAN IS LIKE MATTHEW MCCONAUGHEY AT A COUGAR CONVENTION. HES HERE TO PLAY HOCKEY AND FUCK BITCHES AND BUD, HES ALL OUT OF BITCHES.",10
134,Hi everyone,10
135,I haven’t felt this good watching a game in a while. LETS GO CANES.,12
136,The only thing that would make this game better would be a lax goal 👀,10
137,This is the team I know and love!,12
138,"SIR, I JUST GOT OFF THE PHONE WITH THE FBI. THEY SAY THE ""CUP FAVORITES"" HAVE BEEN SIGHTED",12
139,WE ARE SO FUCKING BACK,9
140,"Man PK legit looks like a starting goalie.

How bout that.",10
141,I still can’t get over that KK goal. The effort and energy from that line starting with Chatmandu.. just peak Rod hockey at its best,10
142,"It's really a huge relief to know that this team has hockey like that in them. I was starting to wonder. Now it's up to the boys to develop some consistency. And I'm tired of being called a doomer when, instead of this, we get lazy, uninspired play. I'm sorry I expect more.",12
143,https://i.redd.it/i5kfr636yc7c1.gif,10
144,https://i.redd.it/014xeof9yc7c1.gif,10
145,Kooch playing like he's 8ft tall right now.,11
146,I have a feeling this team is about to go on a fucking tear. This is a huge confidence building game right here,10
147,Canada isn't even a real country. That trip didn't happen.,9
148,Holy fucking shit more of this the rest of the year please,9
149,#I'M READY FOR A TRIP TO CHATMANDU,12
150,Little jiggle from kooch right there,11
151,Canes looking like we expected them to look like this year,10
152,Pull the goalie cowards,12
153,Man loses his stick and completely holds ours but no penalty. Alrighty then,10
154,3 minutes until i can say it.,11
155,"It's also why the refs can't swallow their f-ing whistles because we're up 5. They're still trying to score, trips are still trips. And there were several.",11
156,Best game of the season (minus the final 2 minutes).,10
157,Love a missed trip right into a goal. Oh well bye bye Vegas!,12
158,I thought Aho had the shorty there great saves at both ends there,9
159,YEAH SVECH YEAH SVECH YEAH SVECH,10
160,Svech takes a soul!!!,9
161,every time we play vegas i am contractually obligated to remind you all that wild bill karlsson is married to a girl who went on the bachelor with her twin sister and had the job “twin”,8
162,Pretty intense first period.,9
163,Can we please bench Pesce? he's been trash,10
164,https://i.redd.it/e37rl0iuoc7c1.gif,10
165,what a fucking gorgeous pass from quickie 😍,10
166,That’s the prettiest goal we have scored all year. And it needs to happen more.,9
167,"“Looking between a variety of legs” - I love this phrase, Tripp",10
168,"Jordan Staal ages like a fine fucking wine. The Paul Bunyan of Thunder Bay. This beast of a man uses an uprooted tree as a hockey stick. You have to look up at him. If you’re 6’8” well then congratulations, you get to kneel down and pray so that you look up at this specimen of a man.",10
169,Oh shit Kooch was looking like he was in some pain there,9
170,Was Kooch looking in pain after that block?,10
171,"Knights goalie is having some trouble with rebound control, need to just plant Staal Bunting and Noesen up there",9
172,Kk!!!!! Pointpergamei on the return!!!,9
173,Who is this team?! Love to see them play like we know they can. Show the league we ain't dead.,9
174,Fresh airmail from Chatmandu,9
175,The change in approach this team has with Andrei is unreal,9
176,"Score another, you pussies",9
177,Need to kill this to keep the momentum,9
178,PYOTR looking S-Tier,8
179,I know it’s been said but kooch’s new mask is mint,9
180,I love when the crowd takes over on All the Small Things,11
181,I liked this period. Why do the canes not simply play every period like this one,10
182,This feels like a “we are here” game. Maybe the Raanta waivers shook them? Determination is different,10
183,Vegas feed intermission has no words,9
184,This shit annoying lol. I’m at work and have missed every goal except the Vegas goal.,7
185,"more goals

https://i.redd.it/hvfhy1umyc7c1.gif",9
186,"1,2,3,4,5,6, we want 7!",10
187,Canes are last year’s streaking Canes tonight against top talent,9
188,Kooch has been unstoppable since the last time he got yanked early,10
189,Lol Pesce didn't even try there but Kooch is strong tonight,9
190,Vegas fans are complaining that skjei cupped the puck for that sixth goal and slid it under the tendy. Wtf are they talking about,9
191,"6-1, and it looks like everyone gets a bonus if they make it 7. There is ZERO sitting on this lead. We're keeping pressure on 200 ft.",9
192,Put in M T Nette you cowards,7
193,"I just realized Jesperi Kotkaniemi ≈≈ Yes, very Kotkaniemi",11
194,That madlad in 114 actually started the wave lol,9
195,"My heart wasn't the only thing that grew 3 sizes during this game, Mike.",9
196,if Quickie made that I'd have passed out,8
197,The shitty part of game management is Vegas can do nastier stuff and get away with it right now because there's no way refs are gonna call it,11
198,Shit happens. Doesn’t erase the previous 55 minutes.,10
199,Ah shit. The no celly was pretty hilarious though,8
200,That puck went into his glove and then teleported underneath him,11
201,for real. in the last TWO MINUTES,8
202,I blame each of the mother Fuckers who did the wave.,9
203,Damnit. I was really looking forward to that 6-1 espn post on instagram tomorrow.,9
204,LOOK AT THE HAPPY BOYS,9
205,Peretz having the time of his life,9
206,still a .909 despite the two late goals that don't matter anyways,9
207,"Glad they aren’t bumping Noesen down even with Svech back, easily the best “4th liner” in hockey right now",8
208,"**Forwards**

Noesen - Aho - Jarvis  
Bunting - Kotkaniemi - Necas  
Martinook - Staal - Fast  
Svechnikov - Drury - Teravainen

**Defense**

Slavin - Burns  
Skjei - Pesce  
Orlov - Chatfield

**Goaltenders**

Kochetkov  
Perets

**Injuries**

Frederik Andersen (Blood Clotting Issue)

**Healthy Scratches**

Tony DeAngelo  
Brendan Lemieux

**PP1:** Aho, Bunting, Jarvis, and Svechnikov with Burns

**PP2:** Drury, Necas, Noesen, and Teravainen with Skjei",7
209,MISTA SVECHNIKOV,7
210,#__SVECH.NET__,9
211,https://i.redd.it/cm9so4blgc7c1.gif,7
212,MY BABY,8
213,My upper body just crumbled because Svech just stole my BACK,8
214,Maybe don't pat him on the back too hard guys!,9
215,"You know... I was thinking ""Man that is a killer deal for Bojangles to dangle free boberry if we score a PP goal with how often we score on the PP"" and then Mister Svech gave us free boberries.",9
216,Was just telling my husband I was worried about turning the game on because I might be bad luck. After he said I had no bearing over wins and loses I turned it on just before Andrei's goal. I love these boys,7
217,Koooooooch,7
218,Early xmas gift from the wife just [showed up.](https://imgur.com/a/5Yyio4s),8
219,Another penalty in the last 2mins of the period. This is getting to be Groundhog Day,8
220,Noesen is way too good for a 4th liner. Dude just pushes through,8
221,Pesce is still proving why he shouldn’t be in this lineup ever again,9
222,I’ve never seen the puck get stuck there before,7
223,Best defensive play by Pesce in weeks,8
224,This is the team playing like the betting favorites. Keep this shit going.,9
225,"I like canes hockey, I love this canes hockey",7
226,just what we need is another injury,9
227,Koochie looked to be in pain,9
228,Kooch looked like he was in pain. Please no.,8
229,Adam gold is wrong. Kooch just needed to stretch it out he’s fine.,8
230,Where has this team been all season?,7
231,"THANK FUCKING GOD
FUCKING HELL
HE FINALLY GOT WHAT HE DESERVED
LETS
GO
KK",8
232,Jesus that was some shot. Pretty sure KK roofed that through some guy's legs,9
233,This Noesen guy is a beast tonight,8
234,Team has some swagger back,8
235,"SVECH IS ON THE GOOD SIDE OF A PENALTY CALL

WHAT IS HAPPENING TONIGHT",8
236,what a fun game to watch when we are playing carolina hurricanes hockey ❤️,7
237,"This is more like hurricanes hockey. 1,2,3, we want 4!",7
238,#THIS PLEASES ME,8
239,God PK just gave someone a death stare,9
240,Bardownski from Buntie,7
241,"Sing me the song of my people, PNC.  
  
🎺🎺🎺",7
242,Boys (and ladies) we are so SvechniBack,9
243,Absolutely our best period this year. Holy fuck.,7
244,"Incredible fucking period boys. This is the effort we all imagined the team would have before the season began. Just giving no inches on either side of the ice and wearing the shit out of the other team, with good scoring to boot",8
245,"Vegas was gaining steam in the last couple of minutes, hope we reset during intermission",8
246,Is Kooch officially hot or not yet?,7
247,omg I got my flair!,7
248,"Ok, on intermission break-

My next game is Saturday- I NEED a KK signature to complete my Christmas list. Any ideas on how to secure said signature?",8
249,“The confidence has been oozing out of this young man and flowing into the rest of the team”,7
250,"https://i.redd.it/hkjhxcuhxc7c1.gif

Kooch on his way to the 3rd.",8
251,https://i.redd.it/939vqvt6yc7c1.gif,10
252,So why can’t we play like this consistently,9
253,PNC DJ just having a great time rn,7
254,why is the game always good when im not watching,9
255,"https://i.redd.it/lfbq5og83d7c1.gif

I enjoy this",9
256,That was for the wave. Which by the way WASNT ME,9
257,Ending was silly as fuck but WOW GOOD GAMEEEE,8
258,Some of you jokers switched up on Koochie real quick.  I remember the PGTs. You know who you are,16
259,Those last two goals were solely because of you morons doing the wave.,25
260,I HAVE LANDED IN RALEIGH AND AM DRIVING TO THE GAME. THANK YOU FOR THE PRAYERS AND SACRIFICES,14
261,https://i.redd.it/6qwx2jmryc7c1.gif,14
262,I understand being up by a lot but don’t get lazy. Last goal was just laziness from the defense,15
263,This one will be earned if they pull it off. Hoping this is the one Kochetkov steals.,7
264,Manifesting our forwards producing,7
265,"Been bored fighting off food cravings all damned day. 

Easily the most disciplined I've had to be in months. I expect the Canes to be the exact same. 

Cmon bois, gimme a reason to stay up.",7
266,where the fuck has pregame man been,7
267,That was a hell of a sequence. Would’ve been nice to get a shorty but I’m content with that,6
268,good kill,7
269,Good kill,7
270,Good kill,7
271,#BEST FRIEND SVECH IS BACK BABY,8
272,Time to activate scoring Svech,7
273,#MY LORGE RUSSIAN SON!!,8
274,MISTA SVECHHHHHHHHHHHHH WELCOME BACK,8
275,"WE MANIFESTED!!! WELCOME BACK, SVECH!!!!!",8
276,#MISTAAAAAAAAAAAAAAAAAAAAAAAAAAAAAAAAAAAAAAAAAAAAAAAAAAAAAAAAAAAAAA SVECHNIKOVVVVVVVVVVVVV,7
277,Hell yeah Svech! Hat trick tonight!!!!,7
278,Svech baby!!!!!!,7
279,SVECH WOO!,7
280,Ya that aint on Kooch. Every single player got beat there.,7
281,"Jfc Svech, you good bro?",6
282,Jersey Mike's really missed an opportunity by not having Danny DeVito and Artemis having sex in a dumpster behind one of their stores and creatively incorporating one of their stale rolls.,7
283,That was a pretty hard smack to the face to just keep skating through,7
284,So… everyone ready for the holidays? Cause I sure as shit ain’t.,8
285,I love Svechnikov so much,6
286,That rebound shot from Necas was fucking sick. Wish it went in.,8
287,Svech is a man on a mission,7
288,Bruh the music rn,7
289,“Heel Job”,8
290,Staal line?? Offense??,6
291,"I love walking back in worry what all I missed, just for Staal to immediately score",6
292,THAT WAS FUCKING SICK,8
293,https://i.redd.it/jmx9iqrtoc7c1.gif,8
294,Yo that pass was fuckin naaaassssty,7
295,Burns has an innate ability to put the puck on the shins of the nearest defender,7
296,wall to wall koochie,7
297,Kooch looked like he was in pain there,7
298,I swear if the feed comes back to Perets in net I'm gonna cry,6
299,Oh good Necas is back on the bench. PHEW,7
300,"Newer hockey fan here, forechecking is defense in our offensive zone, right?",6
301,"Hannah Yates, certified mom.",7
302,# KKKKKKKKKKKKKKKKKKKKK,8
303,#THAT’S HOCKEY BABY!!!,8
304,This feels like the Canes I know and love.,7
305,SMOKING KK!!!,6
306,We’re so fucking back,8
307,Absolutely fucking insane offense right there. Suffocating.,7
308,I LIKE THIS,7
309,KK WHADDAYA SAY!! WHAT A FREAKING SHIFT,7
310,https://i.redd.it/07vzka21rc7c1.gif,7
311,Svech DREW the penalty this time 👀,6
312,Pesce's farm is getting sold and turned into a subdivision 😢,5
313,"Oh thank god Svech is okay, that was such an awkward fall",7
314,What is happening right now lmao,7
315,"PP has been awesome, but holy shit our zone entries have been CRISP tonight. Nice one Bunts",8
316,"GIVE ME ALL THE POWERPLAY GOALS

https://i.redd.it/r5c59qrvrc7c1.gif",7
317,Strong PP tonight,7
318,Oh let's goooooo PP IS about as hard as me,6
319,embellishment much,6
320,Hopefully this home stretch works some magic for us,6
321,I like how Kooch snaps the glove out and holds it there. He looks like a catcher framing a pitch which was about the only part of the position I was good at lol so I appreciate it,6
322,Pytor is Russian for brick wall.,8
323,I can’t think of a better period they’ve had this season,7
324,That was a magnificent fucking period. Things you love to see: it <3,5
325,I hope the Canes finish this game strong and build some momentum for the next game!,7
326,"SETH JARVIS WRAPS UP THE PACKAGE!
Oh, Mike…",8
327,Fuck it give svech a tiny hat to wear for the triple assists,5
328,What in the hell has gotten into our power play lmao,8
329,"I need a Turbo goal. We got a Svech, a KK, and a Jarvis. Turbo redemption goal, please",6
330,Team showed up tonight!,6
331,What the fuck is a microwave goal?,7
332,One more for the “no mercy” THG magnet.,9
333,carry on my skjeiward something or other.  going to try to find caffeine.,7
334,https://i.redd.it/9f8bhy2jzc7c1.gif,6
335,I AM SO EWOK THIS IS CANES HOCKEY,9
336,Brady is a hot guy.,5
337,Marty and Turbo need goals,8
338,Wilbur lmao,7
339,"Ok, I'm gonna try to calm down now",5
