,body,score
11,Wow. Hyman in the box for getting interfered with..,6
12,The Kings breakout game looks so effortless. Impressive really.,5
13,1st line is the only one able to… *penetrate*,7
14,Oil look off tonight.,6
15,Cali reffing starting right on time,7
16,I DONT KNOW BUT THE SINGING OF THESE ANTHEMS IS MAKING MY ASSHOLE CLENCH. Jeez what a butchering.,18
17,"Is that Singh calling the game?


Edit: Asking because of how upset he was that Skinner made that save. Thought it might have been the King's guys",5
18,Skin-daddy has us in this game so far,5
19,Is this the gdt now?,4
20,"Omg....Skinner 

Damnnn",3
21,4th line has had the best shift so far,4
22,"Wow thats a shit call, they're literally holding hyman",4
23,#DIDN'T REALIZE THE GDT WAS GONE BECAUSE I NEVER REFRESHED MY REDDIT LOL LETS GOOOOOOOOOOO,6
24,Classic weak call against vs LA.,6
25,Singer crushing it dayum,3
26,She was cool on karate kid 2,3
27,Is the lighting in the arena fucked or is it my TV?,3
28,The GDT was here earlier?,3
29,"k bros you got the saves you shouldn’t have, go score a goal now",3
30,Fack,3
31,Wake 👏the 👏fuck 👏up 👏,3
32,99 on her jersey. Wow,3
33,Jeez the kings are dominating,5
34,I dun see it either,2
35,K I’m moving over here. Don’t remove it lol,2
36,is it really that hard to rotate the broadcasters on the late night saturday games?? jesus,2
37,You ARE the GDT!,2
38,8:00 pm start. Game casted by Singh. Why live?,2
39,"Fuck it, I'm coming here. 

Someone get the stragglers in the deleted one",2
40,Skinner is a red hot bandit,2
41,"We’re at a 2 right now for energy. Gotta crank that up NOW. 

Were second to every puck.",2
42,Stu coming up big early,2
43,here 4 2nite,2
44,Alright now... let's start playing on the other end,2
45,Building is so quiet can hear everything on the ice,2
46,#FUCK OFF LMAO! BROWN SHORTY INCOMING,2
47,man this fucking singer,2
48,That was the worst national anthem I’ve heard since fergie,2
49,"First world problems: but is it too much to ask for a team to have good lighting setup for showing games?? Gahhdamn, it's LA for cake sakes",2
50,Was that call on Hyman? wtf just happened lol. Classic Oilers phantom call and then cut to commercial.,2
51,It's gone,1
52,I guess this is it now!,1
53,New gdt here lol,1
54,Did I hear Kane was out?,1
55,I can't believe that lady still sings,1
56,Why didnt they bring in Shohei? Great meet hockeys great,1
57,No Ohtani :(,1
58,The boys will score first,1
59,SKINNERRRR,1
60,"I think we lose this one, their entire team is looking for revenge, Talbot, two straight playoff knockouts, T-Mac, I can go on",1
61,STUUUU,1
62,HOT STU'S ON,1
63,Kings came to play,1
64,LUCKY  Brown on  his 9th  life ?,1
65,Louie with the jinx.,1
66,He’s scratched,8
67,Looks like he is playing… disappointing,6
68,He’s doomed 🫡,24
69,"Tellem to fire up the PH cause Brown ain’t playin

Edit: I’m an idiot thought he was scratched. Point still stands I guess??",6
70,"Ya, not sure if I should be here or the other one, lol",2
71,Like Dougie Hamilton? Agree. It's so cringy,5
72,Nah we're keeping up and the Kings have something to prove. They'll run out of gas 😉,3
73,I appreciated her gusto lol,4
74,"She's off pitch.

My ears hurt",7
75,Regrettably.,5
76,Unfortunately,4
77,YEP GET IN BOYS,3
78,👍,2
79,"Yeah? I have no idea. Fucking commercials take priority over the fans, again.",4
80,I think it was a hold on hyms,-1
81,"Agree, minus the little remix at the end that was great",1
82,It always looks diseased in there because of all the black,3
83,"It’s the lighting, I was trying the same shit lol",2
84,Yeah that’s a yikes,5
85,"Sounds like Rogers Place. Place is an absolute library most games. We need some cool Euro style chants or something, you can only yell Let’s go Oilers so many times",1
86,Shhh....we don't talk about that one,1
87,I was saying the same thing to my partner a few mins ago - it’s dark and the colours are fairly dull.,2
88,Media capital of the world has always had crap lighting and video quality.,2
89,Groin too large,1
90,Perfect.😎,16
91,Was he scratched for the guy they brought up?,3
92,It was a heavy swing for sure.,1
93,"He's not terrible, but he's certainly not Edmonton Jack!",3
94,Legit the ice looks mouldy or something. There’s like faint black patches all over it,2
95,lol!,1
96,"Kane is out, they said he tweaked something in practice. Also my bad it looks like Brown is playing.",7
0,Well I think we just watched a guys career end. I think he knew it right there and then too,151
1,"That is Sammy's last game I think, he's unplayable right now. The team played well tonight other than him.",222
2,"#.700

#.700

#.700",48
3,"We allowed 1.80 expected goals against, defensively.

We lost 6-5.

WOOF.",37
4,Leave Sammy in Columbus,71
5,It’s so Samsonover,66
6,Bye bye Sammy.,31
7,What was Willy doing on that OT goal? Looked like he tried to blow the zone on a face off loss? I'm confused.,30
8,"If the 9-3 game didn't convince the coaching staff, this game should.

We held a team to 20 shots on goal and gave 5 goals of offensive support. I dunno how much more the team should be expected to do.

Edit: We also have a losing record, 9-10, I think now vs teams out of a playoff spot.",30
9,"Ive been one of the ""he deserves to get time to figure it out"" people but its over. Samsonov is a non-option in net. Sign Aaron Dell after the Spengler Cup if you have to.",58
10,Sammy to the sun,25
11,We are witnessing history. The worst season by a goaltender in Leafs history.,27
12,"https://preview.redd.it/te46pc5mjc9c1.jpeg?width=776&format=pjpg&auto=webp&s=70db217faaf86cec72b9db4cb1309690bd67500a

I miss you wolly",74
13,"It’s not on Samsonov, Columbus just had a very sustainable .300 shooting percentage because they’re an elite team",89
14,Why is being a Toronto sports fan so hard?,51
15,Send Sammy to the minors,22
16,We have to stop losing to these shit teams and samsonov has to get the fuck outta here. He's cooked.,21
17,"the frustrating thing is the Jackets goalies both sucked tonight, 0.850 combined

Samsonov put up a **0.700**",20
18,We'd be first in the division if Samsonov wasn't literally unplayable.,19
19,"Lol. Collectively, we must have all been gigantic assholes in a past life",18
20,I can't believe they're making Samsonov available to the media,16
21,Samsonov has to go.,37
22,"One of the worst effects of bad goaltending is that pervasive feeling of helplessness among the fans and team as you just watch the same mistakes over and over. You know what's wrong, but can do little else but watch. If it's deflating for the fans it must be doubly as deflating for the players.",35
23,Samsonov is to stopping pucks what Messi is to paying taxes,48
24,That should be Sammy’s last game as a leaf,12
25,Straight to the gulag lol,23
26,"Blame coaching, effort, or whatever all you want. This loss is on Sammy. You got goals and multiple points from all of our top guys, you got decent fight and grit, good special teams, this was a clear cut win. But you just can't let in 6 goals on 20 shots(5 in 11!!). 

I get not putting Jones in for the 3rd to save him for the next game. But imo you shouldnt even have Jones there as a back up in that case, call up hildeby or even Petruzzeli, because this is just brutal.",23
27,Samsonov ain’t it man,10
28,I loved you Sammy,28
29,"Sheldon and Tree can never say the team left points on the table during the season. They started Samsonov 15 times.

The leafs have no confidence with him in net and for good reason.",18
30,Samsonov can't play another game for this team,7
31,"I have been shitting on Samsonov for like 20 minutes, now that I’m watching his post game presser.. I just feel bad for the guy. He’s completely lost it, he seems to still be positive though. 

Fuck man, why do you have to do this to us Sammy",8
32,Thanks Sammy.,16
33,Ilya Samsonov is a hockey terrorist sent by god to ensure the Leafs continued mediocrity,25
34,"If BrianBeLeafs lurks this thread, if you could draw Sammy being fired out of a cannon that might will something into existence. Thanks.",23
35,I can't believe this is the same goalie that won us our first playoff round in over a decade,7
36,Well then….Samsonov. What’s everybody thinking?,7
37,Yikes Sammy. The hell do we even do about this guy?,6
38,"Sammy is the goalie Putin puts in net on the opposing team. 

All this time we thought they were just letting Putin score. Turns out he really did score 7 goals in one game.",5
39,What's Samsonovs down and out/60,6
40,"6 goals on 20 shots. Can’t say this was a team problem. Sammy should be done now. They have him more of an opportunity than he deserved but it’s time to go. Waive him, or see if someone will take him with a 4th round pick or something idk.",4
41,If you score 5 goals and hold your opponent to 20 shots that should be enough to win. We are in serious trouble here until Woll returns,5
42,"Man Nylander I really don't know what he was thinking. Was he just hopeing for a miracle defensive play by Rielly into a breakout pass.

He left Rielly to cover two players",10
43,"If Samsonov starts any further games I won’t be watching, it’s a total waste of time",12
44,Jesus what the hell happened to the defense on that GWG? left Sammy out to dry there.,16
45,Ilya Samsonov get the fuck off my hockey team,28
46,"Call up Hilleby, play Jones both games in a back to back, whatever. Samsonov should not start another game.",3
47,Make a save,5
48,Sammy ate too much turkey.,4
49,"Sammy’s cooked, right?",4
50,hard to get excited about games when the team is playing so mediocre and samsonov is so shit and it’s just a repeat of the same game every time.. only exciting part of watching leafs games is for matthews goals,5
51,I thought Mrazek was our worst goalie of the decade...maybe not.,3
52,"Jesus, I need a mental break from Samsonov",5
53,Sammy should be on waivers first thing in the morning. I think Hildeby could have handled this game tonight just fine. 6 goals on 20 shots. Geezus.,4
54,"Well we have a back to back early next week against the Kings/Ducks.  If we recall Hildeby getting his feet wet against the Ducks wouldn't be the worst thing in the world, they're one of the lowest scoring teams in the league.",4
55,"I've never seen such a change in performance by a player.

Right now he must be one of the worst goalies ever.",4
56,"Yeah Sammy can fuck off, sorry if this sounds harsh but he's quite literally costing us games",6
57,Phwoof....,3
58,"Well, they gotta send Sammy down and figure something out.  Absolutely no reason to be losing games like this.",3
59,"Dude's lost in his own crease, hate to see it",3
60,Samsonov is getting waived,3
61,Sammy needs a new home and it ain’t in Toronto,3
62,Why is he so out of the crease SO often,3
63,Sammy just sucks,3
64,Yikes… on to the next game but damn…. These are the games you need to win.,3
65,Limit to 20 shots on goal and still lose 6-5....the fuck is this shit,3
66,Worse goalie I’ve seen in my 25 years watching this team,3
67,Refund your tickets if Sammy is playing!!! We need change!,3
68,If anyone blames this game on anyone other than Samsonov I'm coming to your house and egging it,3
69,Sammy getting waived is all I can imagine. That was brutal.,3
70,Can’t even stop a fucking beach ball,3
71,I miss Toskala.,3
72,Thank God we only gave Sammy one year. I love the guy but holy shit,3
73,Well.... that was why I didn't want to see Sammy play another game.  Yikes.,3
74,Sounds like they want to keep giving him chances...,3
75,"No sympathy for him, he had ample time to get his game back. Scrub. If he plays one more game it's on management",3
76,God I feel for the guy like he seems like such a genuine good dude but they got to do something now about it the goaltending. Also grab a dman if you can cause that position hasn’t looked great either. I don’t wanna rush the development of the guy on a tear with the Marlies but I don’t exactly think teams are gonna make it easy on us for trading for a goalie knowing our situation. This has genuinely been the worst leaf’s goaltending I’ve ever seen in my 17 years of watching.,3
77,"How the fuck do we give up 6 goals on 21 shots?!  

Sammy I loved you last year, but you’re killing me rn.",3
78,"Bro Sammy 1000% lost us this game.

Even with 2 mulligans this is still a 5-4 game at worst.

Sammy had 3 Mulligans today, that's just not sustainable in the NHL",3
79,"3 goals not Samsonov's fault, so really he only allowed 3 bad goals tonight.  A good game for him.",3
80,"Okay, crazy hot take here: If the Blues are planning to sell at the deadline, we move Sammy to acquire Jordan Binnington.

My reasoning:

1. Between Soup and Sammy, we now have had two super nice, wholesome goalies who stole our hearts, hit a bad stretch, and fell right off a fucking cliff. I'm pretty sure Binnington has rabies, or some sort of rage virus, so maybe he handles the pressure better.

2. 0.900 save percentage, which won't require a king's ransom, but is a massive improvement over what we have

3. Reasonably decent injury history

4. He's won a cup, so playoff experience!

5. Maybe his intensity will rub off on some of our other players?

6. He seems like the kind of guy who would scream right in Morgan Reilly's face for him to take the goddamn pass on a 2 on 1, and make him actually do it (I love you, Mo, but c'mon!)

So yeah. Who says no?",3
81,Been watching hockey for over 35 years. Very good eye. Stanley cup winning teams don't lose like this at the clip the leafs do.,3
82,1 win in 5 games. Team kinda sucks honestly.,7
83,Fuck development at this point bring hildy up we need to be wining games and can we make a move we have cap space and if we can dump sammy we'll have more wtf is the problem.,5
84,Good d on that face off for sure,4
85,Nylander should be grateful that everyone’s too angry at Samsonov to notice his defensive effort in overtime.,4
86,Fuck right off to Siberia you absolute sieve,6
87,"Leafs have lost 15 points this year to the last place teams. And this is why the leafs will always suck.

2 losses to Chicago, CBJ, OTT and Buffalo.

Fuck Samsonov.

Goodnight.",7
88,Lmao,2
89,Welp,2
90,They need to really practice 3 on 3. That was so sloppy and they never looked threatening.,2
91,I do not want to see Sammy as a leaf again.,2
92,Sorry if this has been asked already but I thought after the fourth goal by Columbus that I heard the Leafs old goal song. Was I correct or just hearing things?,2
93,"oof man, this is the end of the line for Sammy.",2
94,samsonov with a yard sale to end it. what a last play in the nhl if hes done,2
95,"Sammy is the worst goalie I have seen in Leafsland. And I have been watching since 1985 so that's saying something.  
(Disclaimer: I was 6 in 1985 so maybe my memory in that first decade is iffy.)",2
96,Just disgusted by this whole Leafs business lately.,2
97,We have our answer. Sammy is unplayable. Get him games with the Marlies if he's able to clear. I don't think he's able to but we'll see.,2
98,Sammy fucking sucks bro,2
99,"sammy should walk back home 
might be a career ender right that",2
100,"xGF 4.09 - 2.14 for the Leafs

Sammy yikes",2
101,Even if you don’t wanna rush Hildeby im pretty sure Petruzzelli would be better at this point,2
102,Dressing room gotta be awkward for sure.,2
103,"Nice knowing you Sammy smiles, take it easy and thanks for your service !",2
104,6 goals on 20 shots. Bruh.,2
105,"Sammy helped our defensive play tonight, I'll give him that.

Guys trying so hard to keep shots off the net.",2
106,Being shot into the sun is like a break,2
107,"The only important question right now is do we save more cap space with a contract termination or burying him in the minors?

Everything else is idiotic",2
108,"So fun to watch us score 5 goals as a team and still lose thanks to a single players performance. I love Sammy and his smile. This just wasn’t good enough. Holding my breath every single shot. 

Maybe last game he plays as a Leaf? How many points have we lost because of Sammy?",2
109,"It’s so rare that the big four all
Score and they lose. Like maybe happened once before.",2
110,I really don't understand how this tough goalie was able to outduel Vasy and was amazing in the playoffs but now just sucks ass.,2
111,Team played well tonight but Sammy let us down for hopefully the last time. How is this the same goalie who won us our first playoff round win in almost 20 years.,2
112,Jones needs to play back to back next week against LA and Anaheim,2
113,At some point does it cross any management or coaches minds that they need to address goaltending and d. I mean we’re not gonna score 5+ every game here (although that would be nice ),2
114,Even Mrazek had the excuse of COVID and multiple leg/groin injuries during his .888 run here,2
115,Bye Sammy 🙁,2
116,Dope another blown lead! Sick,2
117,![gif](giphy|Uq4oh4iI3PGSOxWwMD),2
118,"This is brutal, leafs players post game pretending that samsonov wasn't to blame.  I dare a player to call out samsonov",2
119,I bet they shove Sammy to the media,2
120,I believe Samsonov asked a monkey paw for something. And his punishment was his ability to play goaltender,2
121,"On the one hand, Sammy has been trash and isn't finding it, despite the money/yips/injuries, that should probably be it for him.

On the other hand, maybe his NY's resolution is gonna be to stop some pucks!",2
122,Sammy's gotta go.,2
123,"Canada loses to Sweden, and the leafs and raptors  lose😭",2
124,"Getting points until Woll is back is all I’m concerned about at this point. 1 is better than none. 

 Bring on the canes.",2
125,Even a blind man wouldn’t want to see Samsonov play net,2
126,We might see tears from Ilya,2
127,"I have this theory creeping into my mind that Keefe left samsonov in the game in protest to treliving not already sending him through waivers. I know it's a flight home for the second of a b2b but sometimes in the interest of winning games you have to get a warm body into the crease.

Only reason I can think of is that Keefe wants it to be abundantly clear that Sammy needs to be shipped out.",2
128,Lol the stat Sportsnet just put out. Samsonov SV% through 15 starts is the worst for the Leafs since 89-90. Worst in the entire NHL since 06-07.,2
129,Yer fuckin done Sammy,2
130,mrazek looking good for chi rn…..,2
131,Samsonov is the 2nd worst goalie in the NHL,2
132,This team blows my fucking mind,2
133,Leafs played great. We could have even won with David Ayres in net! Poor Sammy. Some AHL time might do him good. At least we got 1 point. On to tomorrow’s game! GLG!,2
134,"At this rate, Marner, Matthews and Nylander are on pace for exactly 150 goals collectively by the end of the season, assuming they play each of the remaining games at their current pace. For reference last season, they combined for 110 goals, in 2021-22 129 goals, 78 in 2021 (52 game season on pace for 117 in a full season), and in 2019-20 94 goals. This is the peak of this trio, and I'm not sure how much else you can expect from them. The expected GA tonight was about 2, we need a goalie upgrade; as cliche, as that is, Martin Jones and an injured Rookie, Woll, will not be filling the net adequately for 49 more games when the starter coming into this season, Samsonov is UNPLAYABLE IN THE NHL. That's right, for all intents and purposes, at this moment, goalie depth is Woll (IR), Jones, Hildeby (AHL), Petruzelli (AHL), then Samsonov (AHL). This is the reality at the moment, and it's not good enough. A trade must be made for a goalie that is either better or equal to that of Martin Jones, or else we will fade fast, regardless of goal-scoring.",2
135,"I hate to beat on a dead horse but there's no way any NHL team can win with the goaltending Sammy has provided this year. He looked bad in preseason and it carried over to the regular season to the point where he's unplayable now.

Yes defensively there's holes in the Leafs game but you need saves.",2
136,"Obviously Sammy needs to get lost, but they have made unreal defensive mistakes. 

Two from this game

1. that super bad line change
2. I don't recall which goal but Columbus had one guy with the puck at the end boards and 3 Leafs chased him back there. Easy feed to an unguarded slot. Stupid shit from Domi who saw two defenders below the goal line on the puck carrier and decided they needed a third with no shoulder check at all.

There are a couple terrible defensive mistakes or giveaways every night and Sammy is adrift. The latter will resolve itself soon but they'll still desperately need to figure out the former.",2
137,"This is not gonna be a popular take, and I know the line looks bad, but it's really only the Fantilli goal and OT goal (maybe) that are really on him. The rest are defensive errors and bad bounces.",2
138,"Sammy, I love ya but you should never play another game for the Leafs",3
139,Fuck sammy and fuck Keefe for playing him,3
140,"Ya that's likely Sammy's last game as a leaf. 

Thanks for Tampa last year buddy good luck.",2
141,"Sammy was horrible as always, guys lost it, but let’s not forget about Keefe keeping him in. Should have pulled him after 3 goals. The only thing keeping faith in Keefe is he was hoping Sammy would blow it so he would never play him again",3
142,"Mostly AHL D-core did everything they could to limit shots.

Only 11 shots after two period. Fantastic job.

20 shot total with OT. Can't complain about that.",4
143,Lmao my dad is so mad right now he keeps cursing Sammy he needs to relax haha but he did stink this game as well as the defence,2
144,Can’t even blame the defense. How are you supposed to defend with a goalie like that in net where a shot from anywhere is going in?,2
145,"It's not just the fact that Samsonov is playing horribly, Keefe should not be giving him these many chances. He needs to go down to the AHL because Samsonov in the NHL is benefiting no one but the other team.",2
146,"I have been actively passing a kidney stone since the 23rd and somehow, this Samsonov performance has caused me more pain than the kidney stone.",2
147,"Just 2 months ago I was shit on by this sub for saying I hate watching games when Samsonov is in net. Well, here we are folks.",2
148,"Disgusted by Samsonov and by Keefe for keeping him in.

Call up a Marlie already",1
149,Fire keefe and take Sammy with him. Done with everyone,-1
150,Our defence is so trash,1
151,Finally the sub has accepted that samsonov is garbage,1
152,"I can’t even fault Sammy for that OT goal. Johnny hockey made a great play, and Reilly should’ve defended better.",1
153,"Okay we’re all in agreement that Sammy should be waived and sent to the minors. But the defence doesn’t look good either. While Sammy should have had maybe 3 or 4 of the goals. We blew d zone coverage, we lost puck battles too often, we got pinned a few times, and just had bad d overall. 66% of our team really isn’t good enough for a playoff run in its current state, we’re just out scoring our problems which won’t work in the playoffs. When do we start questioning our defensive coordinator?",1
154,Ilya Samsonov you are a Kunlun Red Star,1
155,Ilya Samsonov is a hockey terrorist.,1
156,"I got the idea in the third period that the Leafs took their foot off the gas as a notice to Sammy. They're like, we got 5 for you, now it's your job to win it for us.",1
157,In all seriousness can we send Sammy down and grab Hutch? We can bury 1m of the 3.5 and use that to bring in Hutchinson for 775k. Is that an option? If I'm Tree I'm looking at ALL my options here. He's an absolute disaster in net.,1
158,Should we consider a trade with Edmonton to get Soup back if Edmonton retains some of the Soup's salary?,1
159,Marner's interview was really interesting,1
160,Fire Keefe!,1
161,"Same old fucking pussies as always. This year it's the goalie, always something with these fucking assclowns",-3
162,At this point I genuinely don't give a fuck if he's sobbing in the locker rooms after Ls. Like get him the fuck off my team.,0
163,"😂
https://www.reddit.com/r/leafs/s/oGlf2mgNe0",0
164,"Hopefully the last game we see this goof in a leafs jersey, please come back woll we need you.",0
165,"Amazing response after that terrific game against Ottawa! Sammy sucks, sure. But the team isn’t exactly showing up to put these teams away. They can’t do it.",-1
166,Stfu Mitch.,-4
167,[deleted],-1
168,Mitch is such a liar saying he has confidence and trusts Sammy,-3
169,[deleted],-1
170,why bother playing samsonov...coach is almost as dumb as trudeau,-5
171,[deleted],-20
172,![gif](giphy|rJbYKaBRx3RDy),1
173, Turned it over to the Raptors game which is coming down to the last few seconds and missed the overtime winner.  Looks like I made a good choice.,1
174,2 for 1 deals on Samsonov jerseys,1
175,I just looked at this score without having watched the game. Jesus.,1
176,Anyone have an updated season stats for samsonov,1
177,Bad team + Samsonov was always going to be an L. Sports betting apps should be thankful I don’t like gambling.,1
178,"I'm not mad. Really, I'm not.",1
179,Leave Samsonov in 2023,1
180,I’m tired boss,1
181,Samsonov is unwatchable at this point please get rid of him why is Toronto sports so cursed:(,1
182,So I wonder if the Leafs will go after Jake Allen now - have a tandem of vets behind Woll. Montreal could flip Sammy to another team for a pick,1
183,I was at the game and it was so fun and now I’m just so deflated boys,1
184,Fargle Smarsnoldov!,1
185,Quick start the plane!.....start the plane!!!,1
186,Wow sammy is garbage,1
187,"I hate seeing good people fail. We loved Sammy last year like we loved Campbell the year before. Great lovable personalities but the reality is we were lucky enough to catch the one season they were good.

Letting Jack go was smart. Taking Sammy to arbitration was also smart.

Good franchise goalies are hard to come by, unfortunately.",1
