,body,score
3,"I love that we're winning but if we're gonna be a playoff team we gotta score more. I dont think we have the firepower yet to be a real threat, we're winning games by being relentless and not with skill. Its possible we manage to finish the season with home ice for the first round and Ill be fuckin pumped the whole time even if we lose. But we have a real chance to leverage some of the value that Torts and Danny have built, names like Walker Seeler and Risto have all been in rumors and regardless where we are in the standings we should be selling some assets to try to acquire some picks and maybe prospects that have tangible upsides. Its good that this group has played this well, and theres no reason to think losing Walker or Seeler will tank the season but if it does then we were never ready to compete this year. I can understand not making moves if we're comfortably in second place at the deadline because the playoff experience will be good for everyone and we'll see who finds the next gear, but if we're fighting to be a wildcard we need to sell. This is the second game against the Preds in a week or so, hopefully the team learned enough the first game and has a gameplan to solve their goalies, we need some convincing wins before Im convinced.",12
4,"also cutter and the usa gang play sweden at 12pm eastern time, so get fuckin hype for some pretourney action",12
5,Jesus Christ the Metro is tight. I am beginning to doubt it will ever separate out. It could be neck-and-neck all through the whole season,11
6,Think I might tune in tonight to watch the Flyers for the first time since ~2021. Used to be a regular around here before the team fell apart. I watched every game from 2009-2020 and just had to take a break. Sounds like they're really playing well lately and I'm excited for them to turn the corner.,11
7,Saros got yoinked last game so I'm sure he'll be doing his prime Patrick Roy impersonation tonight.,10
8,if nashville is the predators then we're a bunch of danny glovers,10
9,"Cutter with another laser beam, 2 goals and an assist so far USA up 4-2",9
10,time to teach the danger kitty’s a lesson…,9
11,"cutter has a goal and an assist so far against sweden, just tied it up 2-2",7
12,"Thursday night against western conference team. 

Tickets. Start at $58. :/",8
13,I don’t have the number Infront of me but our record this year is like 4-0 in rematch games where we lost the 1st game.,8
14,"Thinking about going to the game tonight, I do miss the tickets being so cheap when we sucked lol",6
15,"My excitement is slowly growing, my dad who had been a fan since he was born in 66 had given up after last year. For the last year and a half he hadn’t watched a single game, we used to watch games together but after they fell apart something broke inside of him. I finally got him to watch a game again and when they’ve been winning he’s been enjoying the games.",6
16,Should have beaten them last time. Will finish the job this time,5
17,Is Hart playing tonight or are they still figuring him out sickness-wise? Miss our lad,3
18,"Haven't said this in awhile, but i'm Flyered Up boys!!!!!",3
19,Man what is up with Hart that he's basically sick all the time.,5
20,"Gonna be a long late fans to the game tonight, myself included, two lanes closed on 42 from an accident.",2
21,Audio on pregame not synced up with mouths for anyone else or is my tv screwy,2
22,"Blacked out, can’t watch. Bummer.",0
23,"The Burlington near me had Carter Hart jerseys for $30. I was tempted to get one but with my luck, he wont be on the team come the trade deadline, so I left it right on the rack.",-2
24,Sammy Icecube,1
25,"> Surely that’s a typo?

Nope not a typo.",5
26,"I was just thinking yesterday about how we haven't had a true blowout win yet this year. I agree we need to hit another level of dominance here and there to feel solid

Or was there already a game I'm forgetting where we just ran over the other team?",6
27,Is this being televised anywhere?,2
28,I’ve been enjoying watching them this season. I had to turn off around the same time. It just wasn’t worth it for me to stay up late enough for a team that put less effort into games than beer league teams,5
29,"This is me as well. I've kept an eye on the team but the last 2 seasons just broke me. 

Haven't watched every game this year, only a few periods here and there but they are fun to watch man. 

... except for the power play, expect nothing there. 

Sad part is if the pp was even just mediocre instead of complete trash we prolly have 2-3 more wins and are right on the rags in the standings.",2
30,Or the Chris Hansens,1
31,Ancient danger kitties,5
32,Maybe this is the year I get USA jersey,1
33,It’s the holiday spectacular game,2
34,Right? Tickets are so expensive right now,2
35,"Should find out shortly after the morning skate which is happening now.  Hart is at morning skate but so is Petersen and Ersson.   
       
EDIT: [John Tortorella is unsure on who will be backup. Marc Staal comes in for Egor Zamula.](https://twitter.com/JHallNBCS/status/1737855620718739895)",5
36,Definitely concerning.  The timing is lucky that ersson is on fire so we don’t have to rush Hart back.,6
37,"It came out earlier in the week that he had been battling an unknown stomach bug, but they finally figured it out and a treatment that works.",5
38,Yo ho yo ho ☠️,2
39,6-2 vs Minnesota and 10/26 and 5-1 vs Buffalo 11/3 have been our best wins this year,6
40,"theres a few we dominated and a few we got dominated those 5-0 losses to ottawa and the kings and the 7-4 loss to anaheim, we havent seen that team in a while, we've been steadily improving all year so maybe those games were just growing pains, but i wanna see us take over games, even just a few games in a row where we win by more than 1 goal would help ease my mind but some blowouts would really give me that peace of mind",3
41,">except for the power play

Ah so I see nothing has changed haha",1
42,"they look nice, but the numbers are so hard to read on the back",2
43,"Oh yeah, thank you. Wasn't that Buffalo game a redemption game in a home & home series where buffalo won the first one?",2
44,Yep yep,2
45,"Well I mean when G was here our pp was usually pretty good honestly but either the D sucked or we didn't have a goalie

Kinda the opposite now, pp sucks but our 5v5, pk and goaltending are *fantastic*.

This team unironically desperately needs G rn lol",1
46,I assume they’re wearing white. Is it still the white on white numbers with red outline,1
47,Yes we lost the previous game to them 2-5 despite outshooting them 40-15. Hart got yanked early and Sam wasn't much better,2
48,I remember the last few seasons I watched the PP was painfully inconsistent. They’d have stretches where they’d be completely unable to possess the puck in the offensive zone and would go like 1-20 on the PP over weeks before heating up. It was the consistency that drove me crazy.,1
49,ill take a screenshot,2
50,"[https://imgur.com/a/2dE7Tg0](https://imgur.com/a/2dE7Tg0)

trying to get a screen where you can see a bunch of jerseys at a time, and maybe part of it is the feed quality, but this is what it looks like in action",2
51,no its red numbers with a white outline and a blue bar going across the middle so unless you can see the jersey flat all the numbers just kinda look like a patch of colors,1
52,I found a clip. That’s awful. I’ve never been big a fan of the current jersy but red is just a terrible choice there.,1
53,ya theres too much going on at the back and the numbers are kinda small,2
0,It took Jonsey and briere 5 months todo wat fletcher couldn’t do in 4 years.,62
1,Ersson is pissed it didn’t go to shootout,52
2,I feel like they’re doing what Vegas did their first year. Team of misfits completely bought in to the system and everyone knows their role. It is so fun watching good meaningful hockey.,46
3,Imagine if the Flyers figure out how to be competent on the PP. My god.,51
4,"Fuck the devils, fuck the rest of the metro, rangers we're coming for you, flyers run this league 😤",40
5,"I don’t want to blow this out of proportion, but this might be the best hockey team in the history of the sport.",44
6,"strip it, rip it, tippett, goal",38
7,This team is unironically a wagon,37
8,I don’t think it’s an overreaction to say this might be the best team in NHL history.,30
9,"I’m obsessed with the heart of this team. That OT celly just shows how much fun and camaraderie they have. After the last few years, it melts my cold dead soul.",29
10,Love all the Devils fans seething in their post-game thread calling Ersson an AHL goalie 😂😂😂,30
11,**DON'T FORGET THAT WAS A COMEBACK WIN AS WELL!**,27
12,Tipp’s speed is unreal. Not many guys are catching him in full flight.,26
13,I turned to my brother in the second period and said “Tippett looks like shit. Guarantee he scores the game winner.”,28
14,The Eagles are dying so the Flyers can be reborn,51
15,Sam Eraser is becoming an absolute stud. Completely 180 from his first couple of starts. And that steal/snipe from Tipper? Sheeesh. It feels good to be excited about Flyers hockey again.,24
16,"Hey New Jersey 

You just lost to a rebuild",23
17,"Jack Hughes with two horrible turnovers for the tying goal and game winner, absolute Christmas gifts.",24
18,"One Hughes brother lost the puck and the other one skated right by it on the entry.

Now THAT’S sweet",23
19,"Watching the devils fans lose their shit after the OT goal was a shot in the veins. FNJ.

Side note: looked ahead, schedule is brutal starting 12/28. 5 games in 8 days with a 4 game west coast trip mixed in. 😬

EDIT: Math.",22
20,"LOL. The graphic under Torts on the postgame interview:

JOHN TORTORELLA Eagles Head Coach

They wish!",22
21,If torts was the eagles head coach I’m not sure Bradberry would still be there,20
22,"Samuel Errson is the best goalie in his draft class from 2018, he has the most wins for a goalie from that draft as well.",24
23,Holy fuck that was an insane finish,18
24,Tippett just earned himself a spot on the Stanley cup and a spot in Flyers history.,18
25,"Story lines you would have expected a few months ago: ""After an embarrassing loss to a Santa Clara County team, Philly went on to establish themselves as the best team in the league for the rest of 2023, including statement wins over hated division rivals""

It's just the missing team name isn't what you would have expected",17
26,This team is fun.,18
27,"Hope you all have a good night and good sleep and look after yourselves.

Edit: this is for everyone",17
28,NOT TODAY SATAN,17
29,Tippett is the most beautiful parting gift G has left this franchise,36
30,The vibes of this team will carry this city through the night,16
31,What a call by JJ to end the game. long JJ plz,15
32,I love our gingers,16
33,EVERYBODY GET IN HERE,15
34,Tippett yoinked both Hughes brothers in their own house.,30
35,"""OT in OT"" - God among men.",30
36,I didn’t realize Sammy “Icecube” Errson has a 9 game pt streak for starts.,14
37,"Morganti: ‘I mean, we’re living in the upside down. Two goalies like this? And what’s been going on in OT and the shootout?’",12
38,Eat up Hughes,12
39,Tortsy Tortsy Tortsy...What have you created?,14
40,Shoutout Ersson for bouncing back after a meh start to carry in the 3rd and come up huge in OT,12
41,Poehling said they love one another 😭,13
42,this is a sam errson appreciation post 🤘🏻,12
43,Tough to choose our best offensive player between Poehling with two key goals and J Hughes with two key assists on our goals.,23
44,2-0 in the eating ramen while watching Flyers era.,23
45,OT in OT!,11
46,Man... What a finish. I love this current team,11
47,"I moved from Philly to central PA, I can finally watch, boy is there so much to love about this team!",11
48,"What a play by Tippett to win the game, wow!",11
49,I know as a Ranger fan I’m supposed to hate you guys but god damn do I have a soft spot for this team. I’m also a huge fan of torts. Got a chance to meet him once and he was unbelievable. Rooting for this team when they’re not playing NYR. Great game btw Tippett is a beast.,34
50,"an absolute laser from tippett on that game winner.

what a game",9
51,Yay!!!! Beautiful takeaway and goal by Tippett!!,10
52,Next meeting is outdoors in the SS. Game went from “why do we have to be on national tv” to a “must see game”,9
53,"LET'S FUCKING GO!

Huge win. Tippett what a finish.

Really still wonder why Torts didn't challenge NJD Goal #2. I guess he figured it wouldn't be overturned? But that was a blatant slash to the face.",11
54,Thank God for that. Devils got absolutely screwed by the refs in OT. So happy we finally capitalised on that luck for once.,20
55,"The devils were 61% on the faceoff...

  
Damn I miss G",19
56,"I think this team might be the real deal. If you’re still saying they should be tanking, you may need to reevaluate that idea. This team is a contender, and they are proving it every time they hit the ice.",20
57,Owen Tippet is the only positive move Chuck Fletcher made,10
58,Inject that OT play directly into my veins,8
59,"3rd in the East, 8th in the league basically at Christmas. I did NOT have that on my bingo card in September",10
60,"ALLLL ABOARDDDDDDDDDDDDDDDDDDDDDDD

https://youtu.be/14z4ufx5gCQ

Merry Flyermas, youse

https://youtu.be/7suJVVEWt9g",9
61,#THOSE PESKY FLYERS,8
62,“Knock Knock” intensifies 🎶,8
63,THEY JUST WONT LOSE,8
64,The encore just started and I forgot about the JJ^2 audio that happend when the game started,7
65,Omg,7
66,Ginger power,7
67,I like that,8
68,The comeback win gotta love it,7
69,OHHHHHHHHHHHHHHHHHHHHHHHHHHHHHHHHHHHHHHH,8
70,I told you guys I was sensing a Tippett goal!,13
71,"Lol NBCSP saying Tortorella is the head coach of the Eagles

Preparing for heaps of jokes about it on Twitter",12
72,Tippet deserved it tbh he had a few quality chances throughout the game,11
73,Fuck yeah,7
74,hokey gAM w,7
75,Hoooooooo doggy that was mighty fine,5
76,"Damn, sad I missed it, but LGF!",6
77,"I’ve said it before I’ll say it again.

We won the G trade.",11
78,there's no better team than a bad flyers team,11
79,I’m gonna be sad when Walker is traded.,10
80,3rd in the east now,10
81,Eagles head coach 🤭,10
82,Pretty Good,5
83,Yo Josh you bought the wrong hockey team,5
84,TIPPETT IS A FUCKING GOD!!!!!!!!!,10
85,so easy you cant believe it,4
86,Wow what a snipe! Big win tonight!,3
87,Can anyone identify for me the song that was playing during the breakage at 6:32 of the 1st period?,4
88,"Congrats on the dub, Philly fans from a Devils fan. The Devils seem the Philly Eagles of hockey this year…. Ultra talented but we aren’t a lick of help from this coaching staff without Brunnette like last year",-17
89,Best moment for sports fans is when your team becomes surprisingly good and exciting with no expectations to live up to.,1
90,Jonesy and Briere attempting to assemble a losing team is far better than Fletcher or Hextall trying to build winning teams.,37
91,there’s a real science behind this. why some are perpetual losers and some are winners.,10
92,Punching air and saving goals while doing so in the locker room,21
93,He did his breakaway save in the third instead.,16
94,This is where we really need Cutter.,20
95,"They'd be a top 5 team right now, IMO. Would have won them some of those closer games, easily would have made up at least 5 or 6 points in the standings.",2
96,FUCK THE REBUILD WE BACK UP,25
97,I’m gonna say it. Maybe best team in competitive sports ever.,20
98,Totally rational take,9
99,Folks are gonna start hitching up in earnest if the Eagles don't get their shit together,10
100,they are undefeated in 18 of their wins.,29
101,I work in Vegas and they’re the talk of the town according to points bet. /s but also slash ess,5
102,"Be nice, they mean it as a compliment compared to their ECHL goalies.",14
103,I’m legitimately scared that the Eagles are going to steal John Tortorella to coach their defense.,22
104,Nah they’re both gonna win the division,5
105,"Ironically though I feel like we've been better in these fast paced scheduling periods, tonight we were just so flat. This team makes no sense.",11
106,"shhhhhhhh. 


is ok bb.  flyera win big good.",1
107,3 vs 3 OT is so fun,10
108,The move at the blue line too 😮‍💨,8
109,So much fun!! What a difference from last year. You really feel like they are in it and care till the very last second.,3
110,From your lips to god’s ears,2
111,"everyone except Devils fans, go Flyers",3
112,https://i.imgur.com/98kaUxS.jpg,11
113,Anyone got a link? I had to watch NJD feed,2
114,I’m never changing my flair,4
115,He validates my flair every game,13
116,Hughes covert ops ftw,6
117,What kind of ramen?,6
118,"Hey, Lavy is still one of my fav Flyers coaches of all time. Funny how they traded spots after a decade 😂",10
119,"lol, I remember getting downvoted my Rangers fans in the summer for saying that Lavy was the perfect coach for the personnel you guys have. Looks like I was spot on the money. His systems really do thrive with a good d core and goaltending. Still hate your team but I’m a Lavy fan forever and glad to see him still coaching contending teams all these years later. Was kinda sad he was stuck with a mediocre/trash roster in Washington for years.",6
120,"I'll return the love - I like the current Rangers team. Mika + Bread are too universally likable to not root for. It's war for now but if the Rangers are still going after the Flyers, I'll realistically be rooting for them.",3
121,"Yeah I'd be so pissed if I was a Devil's fan. 

Bc then I'd have to root for the Devils.",20
122,"The ensuing Flyers possession was weird too, like everyone on the ice was surprised there was no whistle.",5
123,"Look at the close up replay in the YouTube highlight of the game. Risto lifts his stick and then Hughes catches an edge/dives. It looked like a penalty from far away, but it wasn't.",2
124,"We used to be the best faceoff team in the NHL, but if that’s what we have to sacrifice for whatever the fuck is happening with this team, so be it. Just keep winning",17
125,"Flyers are not contenders… nowhere near it, I’m a devils fan and I’m not hating on your team at all I actually don’t mind the flyers I just fucking hate the Rangers lol. I think you guys are just getting really good coaching, Torts is amazing and I love the guy he’s fucking hilarious. Now if you were to build your roster up even more then I would agree with your claim, I will give it to you though you guys are playing some damn good hockey as of late. Metro is gonna be a close one this year. Grats on the dub by the way, can’t wait for the stadium series!",-8
126,"I dunno, Risto had yet another solid game. Even in OT",4
127,🙌🙌,3
128,That power move he made in the 3rd where he then went to the corner and turned a hit into a reverse hit finished check was unbelievable. He's strong af.,9
129,It's too bad that the Panthers are a decent-ish team this year. That first round pick this coming draft could be the cherry on top.,4
130,I said that when it happened and was called a psycho,2
131,Not happening sorry guys.,6
132,Same,2
133,Hey friend - just checked. Feel So Close by Calvin Harris :),6
134,Go away please.,10
135,GG,3
136,*growls*,6
137,"just gotta wait for the college season to end, Cutter is gonna come in and make a huge impact. let's get Michkov here sooner, grease some palms, stroke some egos",10
138,FUCK THE REBUILD,9
139,Missed you GB,4
140,"I don't know who the fuck earnest is, but somebody needs to warn that dude.",12
141,They were +800 to make the playoffs before start of season.,2
142,Probably what he looked like making the call,3
143,Flyers Instagram posted it,2
144,Spicy beef,7
145,Not as funny as the time Torts and Vigneault traded spots in a summer.,6
146,why don't you guys just bang,1
147,Amen to that,2
148,"Probably because there was a slashing, hooking and tripping infraction all in the space of 3 seconds 😂

Fuck Hughes though. Talented little bastard.",5
149,"It's interesting because I was shaky on Ristolainen for the longest time but watching the games this year, especially recently, it feels like he fits in this system well and generates good chances.",3
150,We’re gonna have to start giving Chuck Fletcher credit. Might be a broken clock thing but he had no right to get what he did with that little leverage.,2
151,Thank you so much!!,2
152,"Well done, saying it nicely!",5
153,Comcast needs to open up that wallet.,12
154,OH IT’S BUILT,6
155,"Nah he's cool, he can handle himself",4
156,That's what I looked like watching that beautiful snipe and hearing that call.,1
157,"instant, homemade, or from a restaurant?",5
158,Soy for the win. Beef is cool too tho,4
159,Happy to help!,2
160,"absolutely. idgaf about war or geopolitics, make the Flyers better",18
161,Ummm. I think you are forgetting about that Russian invasion. No corp $$$ allowed to Russia. He'll get here at the right time and it will be on an especially team-friendly contract when we plan to start spending on FAs. The timing works for long-term success.,-5
162,Instant and it’s good,6
163,Agreed but beef is cheap as well,2
164,I add poached eggs to my ramen.,3
165,I crack and eye and than I just throw it in the microwave.,2
0,Please continue the discussion in the [post game thread](https://redd.it/18o4jn5).,1
1,Shit like this usually happens AGAINST the flyers man what the hell is going on in this crazy ass world,13
2,"What blows my mind is that we have a team that’s *clicking*. In my lifetime all I’ve seen is a producing offense, reliable blue line, or a brick wall of a goaltender, but never all at once. What an unexpectedly fun season!",9
3,"So on The Athletic trade board 2.0, both Walker and Seeler are on the board....

Walker with a market value of $7 million!

Seeler with a market value **$6.3 million!!!**

They use Dom L's market value rating (The contract value they should get based on their play if free agency starts today) but holy hell look how well they're playing! Seeler under a million is playing like a $6.3 million defenseman!?!

Fuckin' A boys, keep it up",9
4,The Errson success has been my favorite storyline this season I think,9
5,I guess boarding is allowed now,10
6,Refs can’t make it any more obvious rn,8
7,"I don’t think I’ve ever seen that in my whole life. 

What an absolute fluke.",9
8,DAMN a TK shortie would've been so sweet there.,8
9,Glad they're reviewing it. Two minutes for that is disgusting.,9
10,I want the job of the guy that holds the tablet for the refs,9
11,"Pardon my French, but Cam is so tight that if you stuck a lump of coal up his ass, in two weeks you'd have a diamond.",8
12,A Dou nut,9
13,"Well.

I guess that’s how you beat Saros.",6
14,"I think I have a crush on someone in this sub 🫢

^jk ^its ^literally ^everyone ^in ^this ^sub",7
15,Can the flyers please get back to their first period selves,7
16,Cam. Buddy. Pal. Dude. My guy. Amigo. Friend. Come on,8
17,"Not sure how recently it’s happened, but Atkinson might need to be benched for a game or two",7
18,I think it’s time Cam watches a few games from the press box.,6
19,Sit Atkinson for a game?,7
20,Holy fuck refs,7
21,"Your boy gimmicky is going to be drink heavily throughout this game, so this is your warning that I will be getting less coherent and more flirty with every single one of you throughout the GDT",6
22,Exactly how we drew it up.,6
23,The grandma from the Toyota commercial can get it,6
24,Nick Seeler is having a hell of a 1st period tonight,7
25,Seeler is a horse,7
26,"Been commenting all night in the r/hockey thread for the Kings-Kraken game that I was in last night thinking it was this thread.

So that’s nice.",6
27,That's boarding. How the fuck is that not a major and suspension,6
28,That’s attempted murder in many states.,6
29,you fuckin better watch out for morgan's big brother now,7
30,Not a slash. Free Cam. Avenge Frost.,7
31,we need to break out the flying V,6
32,Can someone fucking tell Atkinson to fucking LIFT THE PUCK?! He’s had like five breakaways the last two weeks and refuses to go up in the net. He has no fucking confidence in his shot right now and it’s getting old.,7
33,Wooo the annual Disney on ice west coast road trip.,7
34,Refs can kick rocks,6
35,What a fucking play by Risto. Gave it up but he recovered and cleared it. He’s been a fucking great defenseman this year,5
36,Saros is an absolute thief in hockey pads. The flyers could have 4 goals on almost any other goalie in the league.,6
37,Cam is so disappointing man.,6
38,"Atkinson really making his mark on this game 

Sadly",6
39,I said in a recent game thread - Cam needs to sit for a game,5
40,the most bullshit ref'd game ever!,5
41,Refs kinda being jerks right now.,5
42,Nashville has looked pretty good against us,7
43,I blinked and it was in!!,5
44,"Idk what magic Frost pulled, but I guess I'm not going to bed after second period now.",5
45,Man those black jerseys always look nice,4
46,Did the Ellis family ever conduct an investigation into what happened to their son?,5
47,Give Coots the C dammit.,5
48,god I wish tk would just blast a nasty wrister like that right into my face,6
49,2 minutes? Fuck these refs. That's a 5 minute major and game misconduct. Direct shot to the head into the boards.,6
50,"Flyers need to score at least 2 on this major for a big ""fuck you""",5
51,"You know what, at least they're getting to review it!",6
52,Damn Frost got fucked up. Hope he's ok. Fuck,5
53,"I mean if you finish your check on someone who’s facing the boards it’s a major. It doesn’t matter how hard the hit is, the numbers were facing him and he was in a vulnerable position.",5
54,Bouch stop playing devils advocate. We aren’t in a national game it’s okay to be a homer lmfao,5
